{"$schema":"https://json-schema.org/draft/2020-12/schema","$id":"urn:sa2a:actuation-certificate:v1","type":"object","required":["version","effect_digest","principal","policy_epoch","revocation_epoch","generation","nonce","not_before_ms","expires_at_ms","audience","threshold","signatures"],"properties":{"version":{"const":1},"effect_digest":{"type":"string","pattern":"^sha256:[0-9a-f]{64}$"},"principal":{"type":"string","minLength":1},"policy_epoch":{"type":"integer","minimum":0},"revocation_epoch":{"type":"integer","minimum":0},"generation":{"type":"integer","minimum":0},"nonce":{"type":"string","minLength":1},"not_before_ms":{"type":"integer","minimum":0},"expires_at_ms":{"type":"integer","minimum":1},"audience":{"type":"string","minLength":1},"threshold":{"type":"integer","minimum":1},"signatures":{"type":"array","minItems":1}},"additionalProperties":false}